{
  "id": "compare-recorded-values",
  "slug": "compare-recorded-values",
  "status": "published",
  "category": "investigation",
  "order": 30,
  "title": "What were the recorded values—not just the shape?",
  "summary": "Use Table to test a Graph hypothesis against selected samples and decoded events instead of relying on another visual impression.",
  "questions": [
    "What value did this field have around the cursor?",
    "Which controller and motor outputs surrounded the event?",
    "Was a field recorded, derived, unavailable, or simply not selected?"
  ],
  "viewPaths": ["table", "graph", "overview"],
  "concepts": ["shared-timeline", "log-evidence-quality", "configuration-provenance"],
  "blocks": [
    {
      "type": "lead",
      "text": "Graphs are excellent at revealing a story and occasionally too excellent at encouraging one. Table is the numerical cross-check: it shows selected fields as ordered rows, inserts decoded events among them, and follows playback near the same current log time."
    },
    {
      "type": "viewPath",
      "view": "table",
      "steps": [
        "Choose Table.",
        "Use the inspector to add, remove, and arrange the fields relevant to the hypothesis.",
        "Scrub from Graph or use Table playback to reach the interval.",
        "Read adjacent samples and event rows together; return to Graph for shape and duration."
      ]
    },
    {"type": "heading", "level": 2, "title": "What Table is—and is not"},
    {
      "type": "list",
      "style": "bulleted",
      "items": [
        "Columns use the same configurable series presentation as Graph, including supported derived fields.",
        "Event rows preserve decoded event order and use available event or main-frame context time.",
        "The view loads a bounded window around the visible time instead of pretending every large log is a tiny spreadsheet.",
        "Displayed values are formatted for their semantic unit. They are not a byte-for-byte raw-frame dump."
      ]
    },
    {"type": "heading", "level": 2, "title": "Use values to challenge the tuning story"},
    {
      "type": "table",
      "caption": "Useful rows around a suspected event",
      "columns": ["Rows", "Useful check", "Do not conclude"],
      "rows": [
        ["setpoint and gyroADC", "The requested and measured rates at neighbouring samples.", "One sample does not describe latency, damping, or tracking quality."],
        ["axisP, axisI, axisD, axisF", "Which recorded controller contributions were active and how their timing differs.", "Term output is not the configured PID or Feedforward gain."],
        ["axisSum", "The combined controller demand before motor mixing.", "A large value does not identify the term or physical cause responsible."],
        ["motor outputs", "Whether one or more motor commands approach their available boundary while correction is demanded.", "A motor command is not measured RPM, torque, or thrust."],
        ["events and modes", "Whether a mode transition, arming state, adjustment, or other event changes the interpretation.", "Context time does not create timestamp precision absent from the event payload."]
      ]
    },
    {
      "type": "callout",
      "tone": "limit",
      "title": "A sample is not the interval between samples",
      "text": "Table can show what was retained at sampled instants. It cannot prove what happened inside a log gap or above the recording's representable frequency range. Pair it with Graph for transient shape, Spectrum for frequency behaviour, and the observed logging rate for evidence limits."
    },
    {
      "type": "paragraph",
      "text": "Filter and PID settings are separate configuration evidence. Prefer values written into the selected segment's Blackbox header; use clearly labelled associated configuration only as fallback context. A Table row never silently supplies a missing setting."
    },
    {"type": "conceptReference", "concept": "shared-timeline"},
    {"type": "conceptReference", "concept": "configuration-provenance"},
    {"type": "relatedProblems", "problems": ["find-what-happened-at-a-moment", "judge-filter-tune", "judge-control-response"]},
    {"type": "sources"}
  ],
  "sources": [
    {"label": "Table model", "path": "Airframe/App/Airframe/App/DocumentHome/Content/Table/TableModel.swift"},
    {"label": "Table surface", "path": "Airframe/App/Airframe/App/DocumentHome/Content/Table/TableSurface.swift"},
    {"label": "Table field selection", "path": "Airframe/App/Airframe/App/DocumentHome/Content/Table/TableFieldSelection.swift"},
    {"label": "Series value formatting", "path": "Airframe/App/Airframe/App/DocumentHome/Content/SeriesValueFormat.swift"},
    {"label": "Event timing compatibility", "path": "knowledge/BLACKBOX_FORMAT_AND_COMPATIBILITY.md"},
    {"label": "PID interpretation evidence", "path": "knowledge/PID_TUNING_PRINCIPLES.md"}
  ],
  "reviewedAgainst": {"appVersion": "0.1.0", "betaflightVersion": "2026.6.1", "betaflightCommit": "6dbc4218f", "reviewDate": "2026-08-12"}
}
