{
  "id": "chase-vibration-and-noise",
  "slug": "chase-vibration-and-noise",
  "status": "published",
  "category": "tuning",
  "order": 40,
  "title": "Where is the vibration or noise coming from?",
  "summary": "Separate frequency location, throttle dependence, measured motor harmonics, filter boundaries, and downstream residual noise before naming a cause.",
  "questions": [
    "Is this energy tied to throttle or measured motor RPM?",
    "What changed between unfiltered gyro, filtered gyro, D term, and motor output?",
    "Are the configured filters acting in the same region as the observed noise?"
  ],
  "viewPaths": ["spectrum", "graph", "overview"],
  "concepts": ["spectrum-reading", "configuration-provenance", "log-evidence-quality"],
  "blocks": [
    {
      "type": "lead",
      "text": "A tall peak is a location, not a confession. Spectrum lets you ask whether energy stays fixed, follows throttle, follows measured motor speed, survives filtering, or arrives downstream where D term and motors care about it."
    },
    {"type": "gallery", "assets": ["spectrum", "filter-guides"]},
    {
      "type": "viewPath",
      "view": "spectrum",
      "steps": [
        "Begin with Frequency and compare appropriate signal groups, usually pre-filter gyro, filtered gyro, D term, or motors as available.",
        "Switch to Frequency vs Throttle to see whether ridges move with load.",
        "Use Frequency vs RPM when eRPM was logged; confirm motor pole count before trusting mechanical-frequency alignment.",
        "Overlay recorded filter positions and measured RPM-notch harmonics where available.",
        "Measure a narrower time range if the suspected behaviour was brief."
      ]
    },
    {
      "type": "heading",
      "level": 2,
      "title": "Read the signal path, not one screenshot"
    },
    {
      "type": "steps",
      "items": [
        {"title": "Locate", "text": "Frequency mode shows where energy is concentrated and compares axes or signal stages. Hanning windowing is available to reduce leakage tradeoffs."},
        {"title": "Relate", "text": "Throttle-dependent ridges are consistent with propulsion-related behaviour; RPM-aligned harmonics are stronger motor evidence when eRPM and pole count are sound."},
        {"title": "Follow downstream", "text": "Compare what enters the filter path with filtered gyro, D term, and motor output. Raw gyro alone can understate the practical effect of residual high-frequency noise."},
        {"title": "Account for delay", "text": "The inspector can estimate gyro, D-term, and total filter delay when the necessary paired signals exist. Less noise and more delay are both real outcomes."},
        {"title": "Return to time", "text": "Use Graph to see whether the band is continuous, manoeuvre-specific, or concentrated around an impact, propwash recovery, or motor anomaly interval."}
      ]
    },
    {
      "type": "formula",
      "expression": "motor frequency = logged eRPM × 3.333 ÷ motor poles",
      "explanation": "Airframe follows the current Betaflight conversion used for RPM-notch interpretation. The result is only as credible as the recorded eRPM and configured pole count.",
      "variables": [
        {"symbol": "eRPM", "meaning": "Electrical RPM value recorded for a motor"},
        {"symbol": "motor poles", "meaning": "The physical motor magnet-pole count configured for conversion"}
      ]
    },
    {
      "type": "callout",
      "tone": "warning",
      "title": "Do not tune from a universal red line",
      "text": "Familiar 50 Hz, -30 dB, -10 dB, and prop-size regions come from particular tools, examples, and craft classes. Airframe presents setup guides as heuristic context and does not convert them into pass/fail. A quiet spectrum also does not prove safe motors. Check temperature and hardware after cautious changes."
    },
    {"type": "conceptReference", "concept": "spectrum-reading"},
    {"type": "conceptReference", "concept": "configuration-provenance"},
    {"type": "relatedProblems", "problems": ["judge-control-response", "find-what-happened-at-a-moment", "understand-a-flight-at-a-glance"]},
    {"type": "sources"}
  ],
  "sources": [
    {"label": "Spectrum analyzer", "path": "Airframe/Packages/BlackboxAnalysis/Sources/BlackboxAnalysis/Spectrum/AnalysisSpectrumAnalyzer.swift"},
    {"label": "Filter-delay analysis", "path": "Airframe/Packages/BlackboxAnalysis/Sources/BlackboxAnalysis/Spectrum/AnalysisFilterDelay.swift"},
    {"label": "RPM-notch analysis", "path": "Airframe/Packages/BlackboxAnalysis/Sources/BlackboxAnalysis/Spectrum/AnalysisRPMNotch.swift"},
    {"label": "Spectrum inspector and availability", "path": "Airframe/App/Airframe/App/DocumentHome/Content/Spectrum/SpectrumInspector.swift"},
    {"label": "Spectrum evidence and limitations", "path": ".agents/knowledge/SPECTRUM_TUNING_GUIDES.md"},
    {"label": "Betaflight RPM filter", "path": "betaflight/src/main/flight/rpm_filter.c"},
    {"label": "Betaflight tuning principles", "url": "https://betaflight.com/docs/wiki/guides/current/Freestyle-Tuning-Principles"}
  ],
  "reviewedAgainst": {"appVersion": "0.1.0", "betaflightVersion": "2026.6.1", "betaflightCommit": "6dbc4218f", "reviewDate": "2026-08-11"}
}
