{
  "id": "chase-vibration-and-noise",
  "slug": "chase-vibration-and-noise",
  "status": "published",
  "category": "tuning",
  "order": 40,
  "title": "Where is the vibration or noise coming from?",
  "summary": "Use frequency, throttle, eRPM, and time behaviour to separate motor-linked ridges, possible resonances, broadband noise, and one-off events before changing filters.",
  "questions": [
    "Does the energy move with throttle or measured motor RPM?",
    "Is a peak largely stationary, broadband, or confined to one short event?",
    "Which mechanical and recorded-data checks should happen before filter tuning?"
  ],
  "viewPaths": ["spectrum", "graph", "overview"],
  "concepts": ["spectrum-reading", "log-evidence-quality"],
  "blocks": [
    {
      "type": "lead",
      "text": "A tall peak is a location, not a confession. Spectrum helps describe how energy behaves: whether it stays nearly fixed, moves with throttle, aligns with measured motor harmonics, spreads across a broad band, or appears only during one impact or manoeuvre."
    },
    {"type": "image", "asset": "spectrum"},
    {
      "type": "viewPath",
      "view": "spectrum",
      "steps": [
        "Begin with Frequency to locate concentrated and broadband energy across suitable signals and axes.",
        "Switch to Frequency vs Throttle to see whether ridges move as propulsion load changes.",
        "Use Frequency vs RPM when eRPM was logged; confirm motor pole count before trusting mechanical-frequency alignment.",
        "Measure a narrower time range when the suspected behaviour was brief.",
        "Return to Graph to see whether the energy coincides with a move, propwash recovery, impact, or motor-anomaly interval."
      ]
    },
    {"type": "heading", "level": 2, "title": "Classify the behaviour before naming the source"},
    {
      "type": "table",
      "caption": "What a spectral shape can support",
      "columns": ["Observed behaviour", "Evidence it supports", "What it does not prove"],
      "rows": [
        ["Ridge moves with throttle", "A propulsion-linked effect is plausible.", "Throttle is not measured motor speed, and several mechanical sources can move with load."],
        ["Ridge follows measured eRPM harmonics", "Motor-speed linkage is stronger when eRPM and motor poles are sound.", "The exact prop, motor, bearing, frame part, or mounting fault responsible."],
        ["Narrow peak stays nearly fixed", "A possible structural or component resonance deserves inspection.", "That the frame alone caused it; antennas, mounts, cracked parts, props, and other structures can resonate."],
        ["Energy is broadband", "Turbulence, impacts, rough mechanics, or several overlapping sources may be present.", "A single filter or component as the cure."],
        ["Energy exists only in a short range", "The event context matters more than a whole-flight average.", "That the rest of the flight shares the same behaviour."]
      ]
    },
    {
      "type": "formula",
      "expression": "motor frequency = logged eRPM × 3.333 ÷ motor poles",
      "explanation": "Airframe follows the current Betaflight conversion used for RPM-notch interpretation. The result is only as credible as the recorded eRPM and configured motor pole count.",
      "variables": [
        {"symbol": "eRPM", "meaning": "Electrical RPM value recorded for a motor"},
        {"symbol": "motor poles", "meaning": "The physical motor magnet-pole count configured for conversion"}
      ]
    },
    {
      "type": "callout",
      "tone": "warning",
      "title": "Do not diagnose from a universal red line",
      "text": "Familiar frequency regions and dB references come from particular craft classes, plots, and analysis methods. Prop size, KV, voltage, mass, stiffness, prop geometry, sample rate, windowing, and normalization all move the picture. Treat the guides as context, not pass/fail."
    },
    {
      "type": "callout",
      "tone": "note",
      "title": "The next check may be physical",
      "text": "Inspect props, motors, bearings, fasteners, antennas, stack and camera mounting, wiring, and damaged frame parts when the evidence points toward a mechanical source. A log cannot see looseness, heat, or damage directly."
    },
    {
      "type": "paragraph",
      "text": "Once the behaviour is located, judge the filter result separately. That next step compares the signal path, downstream D-term and motor activity, recorded filter positions, and delay instead of asking one peak to answer every question."
    },
    {"type": "conceptReference", "concept": "spectrum-reading"},
    {"type": "conceptReference", "concept": "log-evidence-quality"},
    {"type": "relatedProblems", "problems": ["judge-filter-tune", "find-what-happened-at-a-moment", "setup-health-check"]},
    {"type": "sources"}
  ],
  "sources": [
    {"label": "Spectrum analyzer", "path": "Airframe/Packages/BlackboxAnalysis/Sources/BlackboxAnalysis/Spectrum/AnalysisSpectrumAnalyzer.swift"},
    {"label": "RPM-notch analysis", "path": "Airframe/Packages/BlackboxAnalysis/Sources/BlackboxAnalysis/Spectrum/AnalysisRPMNotch.swift"},
    {"label": "Spectrum inspector and availability", "path": "Airframe/App/Airframe/App/DocumentHome/Content/Spectrum/SpectrumInspector.swift"},
    {"label": "Spectrum evidence and limitations", "path": "knowledge/SPECTRUM_TUNING_GUIDES.md"},
    {"label": "Betaflight RPM filter", "path": "upstreams/betaflight/src/main/flight/rpm_filter.c"},
    {"label": "Betaflight DShot implementation", "path": "upstreams/betaflight/src/main/drivers/dshot.c"}
  ],
  "reviewedAgainst": {"appVersion": "0.1.0", "betaflightVersion": "2026.6.1", "betaflightCommit": "6dbc4218f", "reviewDate": "2026-08-12"}
}
