{
  "id": "compare-recorded-values",
  "slug": "compare-recorded-values",
  "status": "published",
  "category": "investigation",
  "order": 30,
  "title": "What were the recorded values—not just the shape?",
  "summary": "Use Table when the question needs selected samples and decoded events in sequence rather than another visual impression.",
  "questions": [
    "What value did this field have around the cursor?",
    "Which event row sits between these samples?",
    "Was a field recorded, derived, unavailable, or simply not selected?"
  ],
  "viewPaths": ["table", "graph", "overview"],
  "concepts": ["shared-timeline", "log-evidence-quality"],
  "blocks": [
    {
      "type": "lead",
      "text": "Graphs are excellent at revealing a story and occasionally too excellent at encouraging one. Table shows the selected fields as ordered rows, inserts decoded events among them, and follows playback near the current log time."
    },
    {
      "type": "viewPath",
      "view": "table",
      "steps": [
        "Choose Table.",
        "Use the inspector to add, remove, and arrange the fields relevant to the question.",
        "Scrub from Graph or use Table playback to reach the interval.",
        "Read adjacent samples and event rows together; return to Graph for shape and duration."
      ]
    },
    {
      "type": "heading",
      "level": 2,
      "title": "What Table is—and is not"
    },
    {
      "type": "list",
      "style": "bulleted",
      "items": [
        "Columns use the same configurable series presentation as Graph, including supported derived fields.",
        "Event rows preserve decoded event order and use available event or main-frame context time.",
        "The view loads a bounded window around the visible time instead of pretending every large log is a tiny spreadsheet.",
        "Displayed values are formatted for their semantic unit. They are not a byte-for-byte raw-frame dump."
      ]
    },
    {
      "type": "callout",
      "tone": "limit",
      "title": "A sample is not the interval between samples",
      "text": "The table can show what was retained at sampled instants. It cannot prove what happened inside a log gap or above the recording's representable frequency range. For transient shape, pair it with Graph and check the logging rate."
    },
    {"type": "conceptReference", "concept": "shared-timeline"},
    {"type": "relatedProblems", "problems": ["find-what-happened-at-a-moment", "understand-a-flight-at-a-glance", "put-events-back-on-the-map"]},
    {"type": "sources"}
  ],
  "sources": [
    {"label": "Table model", "path": "Airframe/App/Airframe/App/DocumentHome/Content/Table/TableModel.swift"},
    {"label": "Table surface", "path": "Airframe/App/Airframe/App/DocumentHome/Content/Table/TableSurface.swift"},
    {"label": "Table field selection", "path": "Airframe/App/Airframe/App/DocumentHome/Content/Table/TableFieldSelection.swift"},
    {"label": "Series value formatting", "path": "Airframe/App/Airframe/App/DocumentHome/Content/SeriesValueFormat.swift"},
    {"label": "Event timing compatibility", "path": ".agents/knowledge/BLACKBOX_FORMAT_AND_COMPATIBILITY.md"}
  ],
  "reviewedAgainst": {"appVersion": "0.1.0", "betaflightVersion": "2026.6.1", "betaflightCommit": "6dbc4218f", "reviewDate": "2026-08-11"}
}
